{
  "id": "6b8e1f2d-4c3a-4b2e-9d1a-2c3d4e5f6a7b",
  "job_name": "nightly.analytics.lead_funnel_rollup",
  "version": "1.0.0",
  "description": "Nightly rollup of lead-funnel conversion metrics (Marketing -> Qualified -> Hot -> Appointment -> SPK) into the Analytics warehouse for dealer performance dashboards.",
  "state": "active",
  "trigger_type": "cron",
  "cron": "0 2 * * *",
  "interval": null,
  "calendar": null,
  "timezone": "Asia/Jakarta",
  "misfire_policy": "catch_up",
  "dependency": {
    "depends_on": ["workflow.daily_transaction_close.v1"],
    "mode": "all"
  },
  "priority": 5,
  "retry": {
    "max_attempts": 2,
    "backoff_strategy": "fixed",
    "backoff_base_ms": 60000
  },
  "execution_sla": "PT15M",
  "owner_ref": {
    "type": "workflow",
    "id": "workflow.analytics_rollup.v1"
  },
  "missed_run_alert_policy": "alert.scheduler_missed_run.v1",
  "tenant_scope": "global",
  "owner": "analytics-platform-team",
  "tags": ["analytics", "rollup", "nightly"],
  "metadata": {
    "created_by": "system"
  }
}
